{
  "schemaVersion": 3,
  "caseId": "retry-signed-release-quorum",
  "firstMaterialDivergence": "obs-replica-west-41:facts.generation",
  "failureOwner": "official-replica-west",
  "evidenceAssessments": [
    {
      "evidenceId": "obs-manifest-42",
      "factPath": "facts.signatureValid",
      "disposition": "SUPPORT",
      "reason": "The signed manifest is valid and establishes the release occurrence."
    },
    {
      "evidenceId": "obs-manifest-42",
      "factPath": "facts.digest",
      "disposition": "SUPPORT",
      "reason": "The manifest digest matches the pending release digest."
    },
    {
      "evidenceId": "obs-replica-east-42",
      "factPath": "facts.generation",
      "disposition": "SUPPORT",
      "reason": "East confirms generation 42."
    },
    {
      "evidenceId": "obs-replica-east-42",
      "factPath": "facts.digest",
      "disposition": "SUPPORT",
      "reason": "East confirms the manifest digest."
    },
    {
      "evidenceId": "obs-replica-east-42",
      "factPath": "facts.complete",
      "disposition": "SUPPORT",
      "reason": "East reports completion."
    },
    {
      "evidenceId": "obs-replica-west-41",
      "factPath": "facts.generation",
      "disposition": "REJECT",
      "reason": "West reports generation 41, which does not bind to the manifest generation 42."
    },
    {
      "evidenceId": "obs-replica-west-41",
      "factPath": "facts.digest",
      "disposition": "REJECT",
      "reason": "West reports a digest different from the signed manifest digest."
    },
    {
      "evidenceId": "obs-replica-west-41",
      "factPath": "facts.complete",
      "disposition": "CONTEXT",
      "reason": "Completion is reported, but it applies to the mismatched release occurrence."
    }
  ],
  "affectedEntities": [
    "release-42",
    "official-replica-west"
  ],
  "affectedFiles": [],
  "preservedInvariants": [
    "The currently published release remains unchanged until the full quorum is satisfied",
    "Manifest and replica confirmations must bind the same release occurrence",
    "A partial or mismatched quorum is never published"
  ],
  "unresolvedUncertainty": [
    "Whether official-replica-west will provide a complete confirmation for generation 42 and the manifest digest."
  ],
  "summary": "Do not publish release-42: the west replica confirmation is complete only for generation 41 and a different digest. Retry for a matching west confirmation within the policy window.",
  "action": "RETRY_LATER",
  "operations": [],
  "reviewRequest": null,
  "retryPlan": {
    "notBefore": "2026-08-29T20:05:00.000Z",
    "maxAttempts": 3,
    "escalateAfterAttempt": 3,
    "preserveRecordIds": [
      "release-42"
    ],
    "acceptanceConditions": [
      {
        "selector": {
          "sourceId": "official-release-manifest",
          "subjectId": "release-42",
          "kind": "signed-manifest",
          "factPath": "facts.generation"
        },
        "operator": "EQUALS",
        "expectedValue": 42
      },
      {
        "selector": {
          "sourceId": "official-release-manifest",
          "subjectId": "release-42",
          "kind": "signed-manifest",
          "factPath": "facts.digest"
        },
        "operator": "EQUALS",
        "expectedValue": "89f0c287c01ca7af66eeb8197089dfe1484f544d5e93f4982df8a9fd46fc3189"
      },
      {
        "selector": {
          "sourceId": "official-release-manifest",
          "subjectId": "release-42",
          "kind": "signed-manifest",
          "factPath": "facts.signatureValid"
        },
        "operator": "EQUALS",
        "expectedValue": true
      },
      {
        "selector": {
          "sourceId": "official-replica-east",
          "subjectId": "release-42",
          "kind": "replica-confirmation",
          "factPath": "facts.generation"
        },
        "operator": "EQUALS",
        "expectedValue": 42
      },
      {
        "selector": {
          "sourceId": "official-replica-east",
          "subjectId": "release-42",
          "kind": "replica-confirmation",
          "factPath": "facts.digest"
        },
        "operator": "EQUALS",
        "expectedValue": "89f0c287c01ca7af66eeb8197089dfe1484f544d5e93f4982df8a9fd46fc3189"
      },
      {
        "selector": {
          "sourceId": "official-replica-east",
          "subjectId": "release-42",
          "kind": "replica-confirmation",
          "factPath": "facts.complete"
        },
        "operator": "EQUALS",
        "expectedValue": true
      },
      {
        "selector": {
          "sourceId": "official-replica-west",
          "subjectId": "release-42",
          "kind": "replica-confirmation",
          "factPath": "facts.generation"
        },
        "operator": "EQUALS",
        "expectedValue": 42
      },
      {
        "selector": {
          "sourceId": "official-replica-west",
          "subjectId": "release-42",
          "kind": "replica-confirmation",
          "factPath": "facts.digest"
        },
        "operator": "EQUALS",
        "expectedValue": "89f0c287c01ca7af66eeb8197089dfe1484f544d5e93f4982df8a9fd46fc3189"
      },
      {
        "selector": {
          "sourceId": "official-replica-west",
          "subjectId": "release-42",
          "kind": "replica-confirmation",
          "factPath": "facts.complete"
        },
        "operator": "EQUALS",
        "expectedValue": true
      }
    ]
  }
}
