{
  "schemaVersion": 3,
  "caseId": "update-bitemporal-assay-calibration",
  "firstMaterialDivergence": "assay-440 stores calibrationRevision cal-16 and normalizedConcentration 70, but the latest eligible signed calibration effective at its measuredAt is cal-17, yielding 73.",
  "failureOwner": "Canonical assay data for assay-440",
  "evidenceAssessments": [
    {
      "evidenceId": "obs-assay-440",
      "factPath": "facts.measuredAt",
      "disposition": "SUPPORT",
      "reason": "The authoritative final-assay observation establishes measurement time 2026-08-29T19:20:00.000Z for assay-440."
    },
    {
      "evidenceId": "obs-assay-440",
      "factPath": "facts.rawSignal",
      "disposition": "SUPPORT",
      "reason": "The authoritative final-assay observation establishes rawSignal 742 used for recalculation."
    },
    {
      "evidenceId": "obs-assay-440",
      "factPath": "facts.sampleClass",
      "disposition": "SUPPORT",
      "reason": "The assay is serum, matching cal-17 eligibility."
    },
    {
      "evidenceId": "obs-assay-440",
      "factPath": "facts.instrumentOccurrenceId",
      "disposition": "SUPPORT",
      "reason": "The assay is tied to instrument occurrence spectrometer-a-module-2026-04."
    },
    {
      "evidenceId": "obs-calibration-cal-16",
      "factPath": "effectiveAt",
      "disposition": "CONTEXT",
      "reason": "cal-16 was effective before the measurement but was superseded by the later eligible cal-17 before measuredAt."
    },
    {
      "evidenceId": "obs-calibration-cal-17",
      "factPath": "facts.signatureValid",
      "disposition": "SUPPORT",
      "reason": "cal-17 is signed and valid."
    },
    {
      "evidenceId": "obs-calibration-cal-17",
      "factPath": "effectiveAt",
      "disposition": "SUPPORT",
      "reason": "cal-17 became effective at 2026-08-29T19:00:00.000Z, before the 19:20 measurement and later than cal-16."
    },
    {
      "evidenceId": "obs-calibration-cal-17",
      "factPath": "facts.eligibleSampleClasses",
      "disposition": "SUPPORT",
      "reason": "cal-17 explicitly permits serum samples."
    },
    {
      "evidenceId": "obs-calibration-cal-17",
      "factPath": "facts.blankOffset",
      "disposition": "SUPPORT",
      "reason": "Using blankOffset 12 with rawSignal 742 and scale 0.1 produces normalizedConcentration 73."
    },
    {
      "evidenceId": "obs-calibration-cal-17",
      "factPath": "facts.scale",
      "disposition": "SUPPORT",
      "reason": "Scale 0.1 is the controlling calibration scale."
    },
    {
      "evidenceId": "obs-calibration-cal-18",
      "factPath": "effectiveAt",
      "disposition": "REJECT",
      "reason": "cal-18 is future-effective at 2026-08-29T20:10:00.000Z and cannot govern the 19:20 measurement."
    }
  ],
  "affectedEntities": [
    "assay-440",
    "spectrometer-a-module-2026-04"
  ],
  "affectedFiles": [
    "input/canonical.json"
  ],
  "preservedInvariants": [
    "Assay, sample, instrument-occurrence, measurement-time, raw-signal, unit, and final-status identity remain unchanged",
    "A calibration belongs only to its exact instrument occurrence and declared sample class",
    "A later-published or future-effective calibration never rewrites an earlier measurement"
  ],
  "unresolvedUncertainty": [],
  "summary": "Update assay-440 to the signed, serum-eligible cal-17 that was effective at measurement time; its recalculated normalized concentration is 73 mg/L.",
  "action": "UPDATE_DATA",
  "operations": [
    {
      "kind": "SET_RECORD_FIELDS",
      "file": "input/canonical.json",
      "recordId": "assay-440",
      "assignments": [
        {
          "field": "normalizedConcentration",
          "value": 73
        },
        {
          "field": "calibrationRevision",
          "value": "cal-17"
        }
      ]
    }
  ],
  "reviewRequest": null,
  "retryPlan": null
}
