{
  "schemaVersion": 3,
  "caseId": "repair-epoch-delta-materialization",
  "firstMaterialDivergence": "adapter.ts materializes mutations across every input event instead of selecting and materializing only the numerically greatest complete valid epoch.",
  "failureOwner": "adapter.ts materializeEpoch implementation",
  "evidenceAssessments": [
    {
      "evidenceId": "obs-epoch-delta-contract",
      "factPath": "facts.epochField",
      "disposition": "SUPPORT",
      "reason": "The authoritative contract identifies epoch as the isolation boundary required for materialization."
    },
    {
      "evidenceId": "obs-epoch-delta-contract",
      "factPath": "facts.outputOrder",
      "disposition": "SUPPORT",
      "reason": "The contract requires key-ascending output, which the repair preserves."
    }
  ],
  "affectedEntities": [
    "inventory-projection"
  ],
  "affectedFiles": [
    "adapter.ts"
  ],
  "preservedInvariants": [
    "State from different epochs is never combined",
    "Only one complete valid epoch is materialized",
    "Deletes and later key reuse are interpreted inside the selected epoch",
    "Output is sorted by key"
  ],
  "unresolvedUncertainty": [],
  "summary": "The writable adapter contradicts the epoch-scoped materialization rules: it combines mutations from all epochs and does not reject the absence of a complete valid epoch. Repair the adapter only; canonical data remains unchanged.",
  "action": "REPAIR_ADAPTER",
  "operations": [
    {
      "kind": "REPLACE_TEXT",
      "file": "adapter.ts",
      "find": "export interface DeltaEvent {\n  epoch: number;\n  sequence: number;\n  kind: \"BEGIN\" | \"UPSERT\" | \"DELETE\" | \"COMMIT\";\n  key?: string;\n  value?: number;\n}\n\nexport function materializeEpoch(events: DeltaEvent[]): Array<{ key: string; value: number }> {\n  const state = new Map<string, number>();\n  for (const event of events) {\n    if (event.kind === \"UPSERT\" && event.key !== undefined && event.value !== undefined) {\n      state.set(event.key, event.value);\n    } else if (event.kind === \"DELETE\" && event.key !== undefined) {\n      state.delete(event.key);\n    }\n  }\n  return [...state].sort(([left], [right]) => left.localeCompare(right)).map(([key, value]) => ({ key, value }));\n}\n",
      "replace": "export interface DeltaEvent {\n  epoch: number;\n  sequence: number;\n  kind: \"BEGIN\" | \"UPSERT\" | \"DELETE\" | \"COMMIT\";\n  key?: string;\n  value?: number;\n}\n\nexport function materializeEpoch(events: DeltaEvent[]): Array<{ key: string; value: number }> {\n  const byEpoch = new Map<number, DeltaEvent[]>();\n  for (const event of events) {\n    const epochEvents = byEpoch.get(event.epoch) ?? [];\n    epochEvents.push(event);\n    byEpoch.set(event.epoch, epochEvents);\n  }\n\n  const completeEpochs = [...byEpoch.entries()]\n    .map(([epoch, epochEvents]) => ({\n      epoch,\n      events: [...epochEvents].sort((left, right) => left.sequence - right.sequence),\n    }))\n    .filter(({ events }) =>\n      events.length > 0 &&\n      events[0].sequence === 0 &&\n      events[0].kind === \"BEGIN\" &&\n      events[events.length - 1].kind === \"COMMIT\" &&\n      events.every((event, index) => event.sequence === index),\n    );\n\n  if (completeEpochs.length === 0) {\n    throw new Error(\"No complete valid epoch\");\n  }\n\n  const selected = completeEpochs.reduce((greatest, candidate) =>\n    candidate.epoch > greatest.epoch ? candidate : greatest,\n  );\n  const state = new Map<string, number>();\n  for (const event of selected.events) {\n    if (event.kind === \"UPSERT\" && event.key !== undefined && event.value !== undefined) {\n      state.set(event.key, event.value);\n    } else if (event.kind === \"DELETE\" && event.key !== undefined) {\n      state.delete(event.key);\n    }\n  }\n\n  return [...state]\n    .sort(([left], [right]) => left.localeCompare(right))\n    .map(([key, value]) => ({ key, value }));\n}\n",
      "expectedCount": 1
    }
  ],
  "reviewRequest": null,
  "retryPlan": null
}
