{
  "schemaVersion": 3,
  "caseId": "noop-post-cutoff-reclassification",
  "firstMaterialDivergence": "obs-classification-r8 reports revision r8 as open, but its effectiveAt is 2026-08-29T20:30:00.000Z, after the 2026-08-29T20:00:00.000Z cutoff.",
  "failureOwner": "No failure: the canonical snapshot correctly retains the controlling pre-cutoff signed revision.",
  "evidenceAssessments": [
    {
      "evidenceId": "obs-classification-r7",
      "factPath": "effectiveAt",
      "disposition": "SUPPORT",
      "reason": "Its effective time of 2026-08-29T19:00:00.000Z is at or before the cutoff, making r7 the controlling signed classification."
    },
    {
      "evidenceId": "obs-classification-r7",
      "factPath": "facts.revision",
      "disposition": "SUPPORT",
      "reason": "Revision r7 matches canonical classificationRevision."
    },
    {
      "evidenceId": "obs-classification-r8",
      "factPath": "effectiveAt",
      "disposition": "CONTEXT",
      "reason": "Its effective time of 2026-08-29T20:30:00.000Z is after the cutoff, so this signed future-effective revision is not current authority for the snapshot."
    },
    {
      "evidenceId": "obs-classification-r8",
      "factPath": "facts.classification",
      "disposition": "CONTEXT",
      "reason": "The future value open describes a later revision and does not justify changing the cutoff snapshot."
    }
  ],
  "affectedEntities": [
    "policy-77"
  ],
  "affectedFiles": [],
  "preservedInvariants": [
    "Canonical classification represents the signed revision effective at the cutoff",
    "Publication or observation time never substitutes for effective time",
    "No files change when canonical state already matches the controlling revision"
  ],
  "unresolvedUncertainty": [],
  "summary": "The authoritative signed r7 classification was effective before the cutoff and exactly matches canonical state. Signed r8 is future-effective and is retained only as context; no canonical change is warranted.",
  "action": "NO_ACTION",
  "operations": [],
  "reviewRequest": null,
  "retryPlan": null
}
