{
  "schemaVersion": 3,
  "caseId": "noop-post-cutoff-reclassification",
  "firstMaterialDivergence": "none",
  "failureOwner": "none",
  "evidenceAssessments": [
    {
      "evidenceId": "obs-classification-r7",
      "factPath": "effectiveAt",
      "disposition": "SUPPORT",
      "reason": "The signed r7 classification became effective at 2026-08-29T19:00:00.000Z, before the 2026-08-29T20:00:00.000Z cutoff."
    },
    {
      "evidenceId": "obs-classification-r8",
      "factPath": "effectiveAt",
      "disposition": "REJECT",
      "reason": "The signed r8 classification becomes effective at 2026-08-29T20:30:00.000Z, after the cutoff, so it is not current authority."
    }
  ],
  "affectedEntities": [],
  "affectedFiles": [],
  "preservedInvariants": [
    "Canonical classification represents the signed revision effective at the cutoff",
    "Publication or observation time never substitutes for effective time",
    "No files change when canonical state already matches the controlling revision"
  ],
  "unresolvedUncertainty": [],
  "summary": "r7 is the controlling signed classification at the cutoff and already matches canonical state; r8 is future-effective context only.",
  "action": "NO_ACTION",
  "operations": [],
  "reviewRequest": null,
  "retryPlan": null
}
