{
  "schemaVersion": 3,
  "caseId": "retry-signed-release-quorum",
  "firstMaterialDivergence": "obs-replica-west-41 reports generation 41, which does not match the signed manifest generation 42 for release-42.",
  "failureOwner": "official-replica-west",
  "evidenceAssessments": [
    {
      "evidenceId": "obs-manifest-42",
      "factPath": "facts.signatureValid",
      "disposition": "SUPPORT",
      "reason": "The authoritative signed manifest is valid and establishes the release occurrence for the quorum."
    },
    {
      "evidenceId": "obs-replica-east-42",
      "factPath": "facts.complete",
      "disposition": "SUPPORT",
      "reason": "East independently reports completion for the matching release occurrence."
    },
    {
      "evidenceId": "obs-replica-west-41",
      "factPath": "facts.generation",
      "disposition": "REJECT",
      "reason": "West reports generation 41 rather than manifest generation 42, so it cannot satisfy the required quorum."
    }
  ],
  "affectedEntities": [
    "release-42"
  ],
  "affectedFiles": [],
  "preservedInvariants": [
    "The currently published release remains unchanged until the full quorum is satisfied",
    "Manifest and replica confirmations must bind the same release occurrence",
    "A partial or mismatched quorum is never published"
  ],
  "unresolvedUncertainty": [
    "Whether official-replica-west will provide a complete confirmation matching generation 42 and the manifest digest within the bounded retry window."
  ],
  "summary": "The manifest and east confirmation match generation 42 and its digest, but west confirms a different generation and digest. Preserve the pending unpublished record and retry for a matching west confirmation.",
  "action": "RETRY_LATER",
  "operations": [],
  "reviewRequest": null,
  "retryPlan": {
    "notBefore": "2026-08-29T20:05:00.000Z",
    "maxAttempts": 3,
    "escalateAfterAttempt": 3,
    "preserveRecordIds": [
      "release-42"
    ],
    "acceptanceConditions": [
      {
        "selector": {
          "sourceId": "official-release-manifest",
          "subjectId": "release-42",
          "kind": "signed-manifest",
          "factPath": "facts.generation"
        },
        "operator": "EQUALS",
        "expectedValue": 42
      },
      {
        "selector": {
          "sourceId": "official-release-manifest",
          "subjectId": "release-42",
          "kind": "signed-manifest",
          "factPath": "facts.digest"
        },
        "operator": "EQUALS",
        "expectedValue": "89f0c287c01ca7af66eeb8197089dfe1484f544d5e93f4982df8a9fd46fc3189"
      },
      {
        "selector": {
          "sourceId": "official-release-manifest",
          "subjectId": "release-42",
          "kind": "signed-manifest",
          "factPath": "facts.signatureValid"
        },
        "operator": "EQUALS",
        "expectedValue": true
      },
      {
        "selector": {
          "sourceId": "official-replica-east",
          "subjectId": "release-42",
          "kind": "replica-confirmation",
          "factPath": "facts.generation"
        },
        "operator": "EQUALS",
        "expectedValue": 42
      },
      {
        "selector": {
          "sourceId": "official-replica-east",
          "subjectId": "release-42",
          "kind": "replica-confirmation",
          "factPath": "facts.digest"
        },
        "operator": "EQUALS",
        "expectedValue": "89f0c287c01ca7af66eeb8197089dfe1484f544d5e93f4982df8a9fd46fc3189"
      },
      {
        "selector": {
          "sourceId": "official-replica-east",
          "subjectId": "release-42",
          "kind": "replica-confirmation",
          "factPath": "facts.complete"
        },
        "operator": "EQUALS",
        "expectedValue": true
      },
      {
        "selector": {
          "sourceId": "official-replica-west",
          "subjectId": "release-42",
          "kind": "replica-confirmation",
          "factPath": "facts.generation"
        },
        "operator": "EQUALS",
        "expectedValue": 42
      },
      {
        "selector": {
          "sourceId": "official-replica-west",
          "subjectId": "release-42",
          "kind": "replica-confirmation",
          "factPath": "facts.digest"
        },
        "operator": "EQUALS",
        "expectedValue": "89f0c287c01ca7af66eeb8197089dfe1484f544d5e93f4982df8a9fd46fc3189"
      },
      {
        "selector": {
          "sourceId": "official-replica-west",
          "subjectId": "release-42",
          "kind": "replica-confirmation",
          "factPath": "facts.complete"
        },
        "operator": "EQUALS",
        "expectedValue": true
      }
    ]
  }
}
