{
  "schemaVersion": 3,
  "caseId": "repair-epoch-delta-materialization",
  "firstMaterialDivergence": "adapter.ts applies mutations from every input event, rather than validating and selecting one complete epoch before materialization.",
  "failureOwner": "Delta adapter implementation in adapter.ts",
  "evidenceAssessments": [
    {
      "evidenceId": "obs-epoch-delta-contract",
      "factPath": "facts.epochField",
      "disposition": "SUPPORT",
      "reason": "The applicable contract identifies epoch as the event-scoping field."
    },
    {
      "evidenceId": "obs-epoch-delta-contract",
      "factPath": "facts.sequenceField",
      "disposition": "SUPPORT",
      "reason": "The applicable contract identifies sequence as the ordering field."
    },
    {
      "evidenceId": "obs-epoch-delta-contract",
      "factPath": "facts.beginKind",
      "disposition": "SUPPORT",
      "reason": "BEGIN is the contract-defined start boundary."
    },
    {
      "evidenceId": "obs-epoch-delta-contract",
      "factPath": "facts.commitKind",
      "disposition": "SUPPORT",
      "reason": "COMMIT is the contract-defined completion boundary."
    },
    {
      "evidenceId": "obs-epoch-delta-contract",
      "factPath": "facts.mutationKinds",
      "disposition": "SUPPORT",
      "reason": "UPSERT and DELETE are the contract-defined mutations."
    },
    {
      "evidenceId": "obs-epoch-delta-contract",
      "factPath": "facts.outputOrder",
      "disposition": "SUPPORT",
      "reason": "The contract requires key-ascending output."
    }
  ],
  "affectedEntities": [
    "inventory-projection"
  ],
  "affectedFiles": [
    "adapter.ts"
  ],
  "preservedInvariants": [
    "State from different epochs is never combined",
    "Only one complete valid epoch is materialized",
    "Deletes and later key reuse are interpreted inside the selected epoch",
    "Output is sorted by key"
  ],
  "unresolvedUncertainty": [],
  "summary": "Repair the writable adapter to reject invalid epoch streams, choose the numerically greatest complete valid epoch, apply only its ordered mutations from empty state, and preserve key ordering.",
  "action": "REPAIR_ADAPTER",
  "operations": [
    {
      "kind": "REPLACE_TEXT",
      "file": "adapter.ts",
      "find": "export function materializeEpoch(events: DeltaEvent[]): Array<{ key: string; value: number }> {\n  const state = new Map<string, number>();\n  for (const event of events) {\n    if (event.kind === \"UPSERT\" && event.key !== undefined && event.value !== undefined) {\n      state.set(event.key, event.value);\n    } else if (event.kind === \"DELETE\" && event.key !== undefined) {\n      state.delete(event.key);\n    }\n  }\n  return [...state].sort(([left], [right]) => left.localeCompare(right)).map(([key, value]) => ({ key, value }));\n}",
      "replace": "export function materializeEpoch(events: DeltaEvent[]): Array<{ key: string; value: number }> {\n  const byEpoch = new Map<number, DeltaEvent[]>();\n  for (const event of events) {\n    const epochEvents = byEpoch.get(event.epoch) ?? [];\n    epochEvents.push(event);\n    byEpoch.set(event.epoch, epochEvents);\n  }\n\n  const completeEpochs = [...byEpoch.entries()].filter(([, epochEvents]) => {\n    if (epochEvents.length < 2) {\n      return false;\n    }\n\n    const ordered = [...epochEvents].sort((left, right) => left.sequence - right.sequence);\n    return ordered[0].sequence === 0\n      && ordered[0].kind === \"BEGIN\"\n      && ordered[ordered.length - 1].kind === \"COMMIT\"\n      && ordered.every((event, index) => event.sequence === index)\n      && ordered.slice(1, -1).every((event) => event.kind !== \"BEGIN\" && event.kind !== \"COMMIT\");\n  });\n\n  if (completeEpochs.length === 0) {\n    throw new Error(\"No complete valid epoch\");\n  }\n\n  const [, selectedEvents] = completeEpochs.reduce((greatest, candidate) =>\n    candidate[0] > greatest[0] ? candidate : greatest,\n  );\n  const state = new Map<string, number>();\n  for (const event of [...selectedEvents].sort((left, right) => left.sequence - right.sequence)) {\n    if (event.kind === \"UPSERT\" && event.key !== undefined && event.value !== undefined) {\n      state.set(event.key, event.value);\n    } else if (event.kind === \"DELETE\" && event.key !== undefined) {\n      state.delete(event.key);\n    }\n  }\n\n  return [...state]\n    .sort(([left], [right]) => left.localeCompare(right))\n    .map(([key, value]) => ({ key, value }));\n}",
      "expectedCount": 1
    }
  ],
  "reviewRequest": null,
  "retryPlan": null
}
