{
  "schemaVersion": 3,
  "caseId": "review-composite-asset-identity",
  "firstMaterialDivergence": "Inspection inspection-882 provides the shared asset label but omits both assetSerial and siteCode, so it cannot be bound to one exact registered occurrence.",
  "failureOwner": "official-inspection-log",
  "evidenceAssessments": [
    {
      "evidenceId": "obs-inspection-882",
      "factPath": "facts.assetSerial",
      "disposition": "SUPPORT",
      "reason": "The authoritative signed inspection explicitly has a null serial, leaving the required occurrence identifier absent."
    },
    {
      "evidenceId": "obs-inspection-882",
      "factPath": "facts.siteCode",
      "disposition": "SUPPORT",
      "reason": "The authoritative signed inspection explicitly has a null site code, leaving the second required binding field absent."
    },
    {
      "evidenceId": "obs-asset-east-8",
      "factPath": "facts.assetLabel",
      "disposition": "CONTEXT",
      "reason": "The registry associates the shared label with active occurrence E-8804 at EAST, demonstrating one possible match."
    },
    {
      "evidenceId": "obs-asset-west-8",
      "factPath": "facts.assetLabel",
      "disposition": "CONTEXT",
      "reason": "The registry associates the same label with distinct active occurrence W-8819 at WEST, establishing ambiguity."
    }
  ],
  "affectedEntities": [
    "inspection-882",
    "asset-east-8",
    "asset-west-8"
  ],
  "affectedFiles": [],
  "preservedInvariants": [
    "A display label is not a stable asset occurrence identifier",
    "Distinct site and serial pairs remain distinct even when labels match",
    "No maintenance record is mutated without one exact asset occurrence"
  ],
  "unresolvedUncertainty": [
    "Which registered asset occurrence the inspection concerns",
    "The inspection's authoritative assetSerial and siteCode"
  ],
  "summary": "Two active registry occurrences share the inspection label, while the signed inspection omits both required binding fields. A person must obtain the exact fields from the inspection authority before any mutation.",
  "action": "HUMAN_REVIEW",
  "operations": [],
  "reviewRequest": {
    "subjectId": "inspection-882",
    "targetEvidenceId": "obs-inspection-882",
    "requestedFactPaths": [
      "facts.assetSerial",
      "facts.siteCode"
    ]
  },
  "retryPlan": null
}
