{
  "schemaVersion": 3,
  "caseId": "review-composite-asset-identity",
  "firstMaterialDivergence": "inspection-882.assetSerial",
  "failureOwner": "official-inspection-log",
  "evidenceAssessments": [
    {
      "evidenceId": "obs-inspection-882",
      "factPath": "facts.assetSerial",
      "disposition": "SUPPORT",
      "reason": "The inspection supplies no serial, so it cannot identify an exact asset occurrence."
    },
    {
      "evidenceId": "obs-inspection-882",
      "factPath": "facts.siteCode",
      "disposition": "SUPPORT",
      "reason": "The inspection supplies no site code, leaving the asset binding incomplete."
    },
    {
      "evidenceId": "obs-asset-east-8",
      "factPath": "facts.assetLabel",
      "disposition": "CONTEXT",
      "reason": "This active registry occurrence shares the inspection label."
    },
    {
      "evidenceId": "obs-asset-east-8",
      "factPath": "facts.assetSerial",
      "disposition": "CONTEXT",
      "reason": "This registry occurrence has serial E-8804."
    },
    {
      "evidenceId": "obs-asset-west-8",
      "factPath": "facts.assetLabel",
      "disposition": "CONTEXT",
      "reason": "This active registry occurrence also shares the inspection label."
    },
    {
      "evidenceId": "obs-asset-west-8",
      "factPath": "facts.assetSerial",
      "disposition": "CONTEXT",
      "reason": "This separate registry occurrence has serial W-8819."
    }
  ],
  "affectedEntities": [
    "inspection-882",
    "asset-east-8",
    "asset-west-8"
  ],
  "affectedFiles": [],
  "preservedInvariants": [
    "A display label is not a stable asset occurrence identifier",
    "Distinct site and serial pairs remain distinct even when labels match",
    "No maintenance record is mutated without one exact asset occurrence"
  ],
  "unresolvedUncertainty": [
    "The inspection's assetSerial and siteCode are absent, so Rotor Unit 8 cannot be bound to either registry occurrence."
  ],
  "summary": "Two registry occurrences share the inspection label, while the signed inspection omits both required binding fields. Do not mutate the unresolved maintenance record until the inspection authority supplies both fields.",
  "action": "HUMAN_REVIEW",
  "operations": [],
  "reviewRequest": {
    "subjectId": "inspection-882",
    "targetEvidenceId": "obs-inspection-882",
    "requestedFactPaths": [
      "facts.assetSerial",
      "facts.siteCode"
    ]
  },
  "retryPlan": null
}
